[
  {
    "name": "Sandor Ellix Katz",
    "description": "Author and educator whose work explores traditional fermentation techniques, history, culture, and microbial processes across a wide range of foods and beverages.",
    "website": "https://www.wildfermentation.com/",
    "area": [
      "General Fermentation",
      "Traditional & Indigenous Fermentation",
      "Vegetables",
      "Cultured Dairy",
      "Sourdough",
      "Vinegar",
      "US and Canadian"
    ],
    "resourceType": [
      "Learn to Ferment",
      "Go Deeper"
    ],
    "mediaType": [
      "Website"
    ]
  },
  {
    "name": "Kirsten and Christopher Shockey / FermentWorks",
    "description": "Practical authors and educators covering fermented vegetables, vinegar, cider, koji, miso, tempeh, and other home-scale fermentation traditions.",
    "website": "https://ferment.works/",
    "area": [
      "General Fermentation",
      "Vegetables",
      "Vinegar",
      "Cider",
      "Koji",
      "Miso",
      "Tempeh",
      "US and Canadian"
    ],
    "resourceType": [
      "Learn to Ferment",
      "Go Deeper"
    ],
    "mediaType": [
      "Website"
    ]
  },
  {
    "name": "Pascal Baudar / Wild Food Lab",
    "description": "Educator and author specializing in wild foods, indigenous microbes, terroir, and experimental fermentation using foraged ingredients.",
    "website": "https://www.wildfoodlab.com/",
    "area": [
      "Wild & Foraged Fermentation",
      "Traditional & Indigenous Fermentation",
      "Vegetables",
      "Fruit",
      "US and Canadian"
    ],
    "resourceType": [
      "Learn to Ferment",
      "Go Deeper"
    ],
    "mediaType": [
      "Website"
    ]
  },
  {
    "name": "Wolfe Lab at Tufts University",
    "description": "Benjamin Wolfe's microbial-ecology laboratory studies the communities that form fermented foods including cheese, sourdough, and kimchi.",
    "website": "https://sites.tufts.edu/wolfelab/",
    "area": [
      "Fermentation Science",
      "Microbiology",
      "Cheese",
      "Sourdough",
      "Kimchi",
      "US and Canadian"
    ],
    "resourceType": [
      "Go Deeper"
    ],
    "mediaType": [
      "Website"
    ]
  },
  {
    "name": "MicrobialFoods.org",
    "description": "Science-focused project explaining fermented-food microbes, research, producers, and the microbial ecology behind fermentation.",
    "website": "https://microbialfoods.org/",
    "area": [
      "General Fermentation",
      "Fermentation Science",
      "Microbiology",
      "US and Canadian",
      "European"
    ],
    "resourceType": [
      "Go Deeper"
    ],
    "mediaType": [
      "Website"
    ]
  },
  {
    "name": "National Center for Home Food Preservation",
    "description": "USDA-supported source of current, research-based home food preservation recommendations, including tested fermentation guidance.",
    "website": "https://nchfp.uga.edu/how/ferment/",
    "area": [
      "Vegetables",
      "Food Safety",
      "US and Canadian"
    ],
    "resourceType": [
      "Learn to Ferment",
      "Safety & Troubleshooting"
    ],
    "mediaType": [
      "Website"
    ]
  },
  {
    "name": "NC State Extension Fermentation Resources",
    "description": "Research-based home fermentation, food-safety, and troubleshooting guidance from a university extension program.",
    "website": "https://foodsafety.ces.ncsu.edu/home-food-preservation-2/fermentation/",
    "area": [
      "General Fermentation",
      "Vegetables",
      "Kombucha",
      "Cultured Dairy",
      "Food Safety",
      "US and Canadian"
    ],
    "resourceType": [
      "Learn to Ferment",
      "Safety & Troubleshooting"
    ],
    "mediaType": [
      "Website"
    ]
  },
  {
    "name": "Puratos Sourdough Library",
    "description": "A scientific and cultural collection preserving and analyzing sourdough cultures from around the world, with an accessible virtual library.",
    "website": "https://sourdoughlibrary.puratos.com/en/virtual-sourdough-library",
    "area": [
      "Sourdough",
      "Bread",
      "Fermentation Science",
      "Microbiology",
      "European"
    ],
    "resourceType": [
      "Go Deeper"
    ],
    "mediaType": [
      "Website"
    ]
  },
  {
    "name": "American Cheese Society",
    "description": "Professional organization offering education, resources, standards, and community for artisan cheesemakers and cheese professionals.",
    "website": "https://www.cheesesociety.org/",
    "area": [
      "Cheese",
      "Cultured Dairy",
      "Food Safety",
      "US and Canadian"
    ],
    "resourceType": [
      "Go Deeper",
      "Safety & Troubleshooting",
      "Organizations & Communities"
    ],
    "mediaType": [
      "Website"
    ]
  },
  {
    "name": "American Cheese Society Body of Knowledge",
    "description": "Technical framework covering milk microbiology, chemistry, cheesemaking, ripening, sensory evaluation, safety, and operations.",
    "website": "https://www.cheesesociety.org/resources/cheese-education/body-of-knowledge",
    "area": [
      "Cheese",
      "Cultured Dairy",
      "Fermentation Science",
      "Microbiology",
      "Food Safety",
      "US and Canadian"
    ],
    "resourceType": [
      "Go Deeper",
      "Safety & Troubleshooting"
    ],
    "mediaType": [
      "Website"
    ]
  },
  {
    "name": "Charlie Bamforth / Brewing & Beer",
    "description": "Academic brewing scientist and educator whose work explains brewing chemistry, process control, quality, flavor, and beer stability.",
    "website": "https://bamforth.faculty.ucdavis.edu/",
    "area": [
      "Beer",
      "Fermentation Science",
      "US and Canadian"
    ],
    "resourceType": [
      "Go Deeper"
    ],
    "mediaType": [
      "Website"
    ]
  },
  {
    "name": "John Palmer / How to Brew",
    "description": "Technically rigorous and approachable brewing reference covering ingredients, process, water chemistry, yeast, recipe design, and troubleshooting.",
    "website": "https://howtobrew.com/",
    "area": [
      "Beer",
      "Fermentation Science",
      "US and Canadian"
    ],
    "resourceType": [
      "Learn to Ferment",
      "Go Deeper",
      "Safety & Troubleshooting"
    ],
    "mediaType": [
      "Website"
    ]
  },
  {
    "name": "American Homebrewers Association",
    "description": "Membership organization with a substantial educational library for homebrewing beer, mead, and cider and an active practitioner community.",
    "website": "https://www.homebrewersassociation.org/how-to-brew/",
    "area": [
      "Beer",
      "Mead",
      "Cider",
      "US and Canadian"
    ],
    "resourceType": [
      "Learn to Ferment",
      "Go Deeper",
      "Organizations & Communities"
    ],
    "mediaType": [
      "Website"
    ]
  },
  {
    "name": "Milk The Funk Wiki",
    "description": "Evidence-driven community knowledge base for Brettanomyces, lactic-acid bacteria, mixed cultures, spontaneous fermentation, and alternative brewing microbes.",
    "website": "https://www.milkthefunk.com/wiki/Main_Page",
    "area": [
      "Beer",
      "Wild & Sour Beer",
      "Fermentation Science",
      "Microbiology",
      "US and Canadian"
    ],
    "resourceType": [
      "Go Deeper",
      "Safety & Troubleshooting",
      "Organizations & Communities"
    ],
    "mediaType": [
      "Website"
    ]
  },
  {
    "name": "UC Davis Viticulture and Enology",
    "description": "Major academic center for grape growing and wine science, with research and industry resources on fermentation, chemistry, sensory science, and production.",
    "website": "https://wine.ucdavis.edu/",
    "area": [
      "Wine",
      "Fermentation Science",
      "Microbiology",
      "US and Canadian"
    ],
    "resourceType": [
      "Go Deeper",
      "Organizations & Communities"
    ],
    "mediaType": [
      "Website"
    ]
  },
  {
    "name": "UC Davis Wine Fermentation Management Guide",
    "description": "Technical guidance on wine microorganisms, yeast nutrition, temperature, pH, oxygen, sanitation, and sluggish or stuck fermentations.",
    "website": "https://wine.ucdavis.edu/industry-info/enology/fermentation-management-guides/wine-fermentation",
    "area": [
      "Wine",
      "Fermentation Science",
      "Microbiology",
      "Food Safety",
      "US and Canadian"
    ],
    "resourceType": [
      "Go Deeper",
      "Safety & Troubleshooting"
    ],
    "mediaType": [
      "Website"
    ]
  },
  {
    "name": "Cornell Enology Extension",
    "description": "Research and extension material on wine fermentation, acidity, sanitation, yeast, malolactic fermentation, and cool-climate winemaking.",
    "website": "https://cals.cornell.edu/cornell-agritech/our-expertise/craft-beverage-production/enology",
    "area": [
      "Wine",
      "Fermentation Science",
      "Microbiology",
      "Food Safety",
      "US and Canadian"
    ],
    "resourceType": [
      "Go Deeper",
      "Safety & Troubleshooting"
    ],
    "mediaType": [
      "Website"
    ]
  },
  {
    "name": "Ken Schramm / Schramm's Mead",
    "description": "Influential modern meadmaker, educator, competition co-founder, and author of a foundational practical reference on meadmaking.",
    "website": "https://www.schrammsmead.com/the-team/",
    "area": [
      "Mead",
      "US and Canadian"
    ],
    "resourceType": [
      "Learn to Ferment",
      "Go Deeper"
    ],
    "mediaType": [
      "Website"
    ]
  },
  {
    "name": "Andrew Lea / Wittenham Hill Cider Portal",
    "description": "Technical cider resource from a fermentation scientist covering cider chemistry, microbiology, apple processing, production, and troubleshooting.",
    "website": "http://www.cider.org.uk/",
    "area": [
      "Cider",
      "Fermentation Science",
      "Microbiology",
      "European"
    ],
    "resourceType": [
      "Learn to Ferment",
      "Go Deeper",
      "Safety & Troubleshooting"
    ],